[
  {"candidate_id":"cn-miit-2024-02-batch","review_status":"approved_for_explanation","reviewer_decision":"accept_as_evidence","reviewer_notes":"已核验工信部页面标题、日期和批次描述；仅接受为移动端批次级行为类比。","accepted_record_id":"ev-cn-miit-2024-02-batch","rejection_reason":null,"requires_more_evidence":false,"risk_of_misclassification":"high"},
  {"candidate_id":"cn-miit-2024-08-batch","review_status":"approved_for_explanation","reviewer_decision":"accept_as_evidence","reviewer_notes":"已核验官方页面；不复制具体名单，不建立 Windows 实体映射。","accepted_record_id":"ev-cn-miit-2024-08-batch","rejection_reason":null,"requires_more_evidence":false,"risk_of_misclassification":"high"},
  {"candidate_id":"cn-miit-2025-03-batch","review_status":"approved_for_explanation","reviewer_decision":"accept_as_evidence","reviewer_notes":"已核验官方页面的 APP/SDK 与个人信息治理范围；仅 explanation-only。","accepted_record_id":"ev-cn-miit-2025-03-batch","rejection_reason":null,"requires_more_evidence":false,"risk_of_misclassification":"high"},
  {"candidate_id":"cn-miit-2025-05-batch","review_status":"approved_for_explanation","reviewer_decision":"accept_as_evidence","reviewer_notes":"已核验官方页面；不使用附件实体，防止生成移动端或 Windows 黑名单。","accepted_record_id":"ev-cn-miit-2025-05-batch","rejection_reason":null,"requires_more_evidence":false,"risk_of_misclassification":"high"},
  {"candidate_id":"cn-miit-2026-01-batch","review_status":"approved_for_explanation","reviewer_decision":"accept_as_evidence","reviewer_notes":"已核验官方页面；保持 mobile_sdk/analogical_behavior 和人工复核边界。","accepted_record_id":"ev-cn-miit-2026-01-batch","rejection_reason":null,"requires_more_evidence":false,"risk_of_misclassification":"high"}
]
