[
  {"candidate_id": "candidate-ms-installcore", "review_status": "approved_for_explanation", "reviewer_decision": "accept_as_evidence", "reviewer_notes": "已人工核对官方页面标题、发布日期、Windows entity 和行为摘要；只准用于解释与复核。", "accepted_record_id": "ev-real-ms-installcore", "rejection_reason": null, "requires_more_evidence": false, "risk_of_misclassification": "medium"},
  {"candidate_id": "candidate-ms-fusioncore", "review_status": "approved_for_explanation", "reviewer_decision": "accept_as_evidence", "reviewer_notes": "已人工核对官方页面；行为摘要限定为 bundling，不扩展到其他软件。", "accepted_record_id": "ev-real-ms-fusioncore", "rejection_reason": null, "requires_more_evidence": false, "risk_of_misclassification": "medium"},
  {"candidate_id": "candidate-ms-slimware", "review_status": "approved_for_explanation", "reviewer_decision": "accept_as_evidence", "reviewer_notes": "已人工核对页面中的 PUA detection family 与行为描述；别名匹配仍需人工确认。", "accepted_record_id": "ev-real-ms-slimware", "rejection_reason": null, "requires_more_evidence": false, "risk_of_misclassification": "medium"},
  {"candidate_id": "candidate-ms-piriformbundler", "review_status": "approved_for_explanation", "reviewer_decision": "accept_as_evidence", "reviewer_notes": "已核对页面仅针对特定 bundling installers；设置高误伤风险，禁止泛化到产品或发布者。", "accepted_record_id": "ev-real-ms-piriformbundler", "rejection_reason": null, "requires_more_evidence": false, "risk_of_misclassification": "high"},
  {"candidate_id": "candidate-ms-mediaarena", "review_status": "approved_for_explanation", "reviewer_decision": "accept_as_evidence", "reviewer_notes": "已人工核对官方页面标题、日期与浏览器行为；同名命中仍需本地身份复核。", "accepted_record_id": "ev-real-ms-mediaarena", "rejection_reason": null, "requires_more_evidence": false, "risk_of_misclassification": "medium"}
]
